<?xml version="1.0" encoding="UTF-8"?>
<!--<!DOCTYPE config SYSTEM "../../src/signalsandgateways/gateway/GatewayConfig.dtd">-->
<config>

	<gateway id="gateway1">
		<routing>
			<route source="0" destination="1">
				<canframe canId="1"/>
				<canframe canId="2"/>
				<canframe canId="3"/>
			</route>
		</routing>
		<buffering>
			<pool>
				<holdup time="5ms">
					<canframe canId="1"/>
				</holdup>
				<holdup time="10ms">
					<canframe canId="2"/>
				</holdup>
			</pool>
		</buffering>
		<transformation destination="1" type="toEthernet">
			<ethernetqframe dst="0A-00-00-00-00-04" vid="1" pcp="7">
				<canframe canId="1"/>
				<canframe canId="2"/>
				<canframe canId="3"/>
			</ethernetqframe>
		</transformation>
	</gateway>
	
	<gateway id="gateway2">
		<routing>
			<route source="1" destination="0">
				<ethernetqframe dst="0A-00-00-00-00-04" vid="1"/>
			</route>
		</routing>
		<transformation destination="0" type="toCan">
			<ethernetqframe dst="0A-00-00-00-00-04"/>
		</transformation>
	</gateway>
	
</config>
